Nombre,Puntuación,Comida,Servicio,Ambiente,Fecha,Comentario,Platos recomendados,Número de reseñas
Juan Pérez,5,5,5,5,hace 2 días,"Excelente restaurante, la comida estuvo deliciosa y el servicio impecable.",Pizza Margherita,15
María García,4,4,4,5,hace 1 semana,"Muy buena experiencia, aunque el tiempo de espera fue un poco largo.",Pasta Carbonara,8
Carlos López,2,2,3,2,hace 3 semanas,"La comida no estuvo tan buena como esperaba, servicio regular.",,23
Ana Martínez,5,5,5,4,hace 1 mes,"Increíble lugar, definitivamente volveré. Todo estuvo perfecto.",Lasagna,5
Pedro Sánchez,3,3,3,4,hace 2 meses,"Experiencia promedio, nada extraordinario pero tampoco malo.",Ensalada César,42
